{
  "artifact_id": "cand_018f3e40-7b80-7a21-8000-000000000002",
  "artifact_id_origin": "native",
  "artifact_kind": "CandidateArtifact",
  "artifact_schema_version": "1.0.0",
  "availability": "available",
  "classification": "private_operational",
  "created_at": "2026-08-10T12:00:00Z",
  "created_by": "platform_steward",
  "digest": "sha256:2222222222222222222222222222222222222222222222222222222222222222",
  "id": "aref_018f3e40-7b80-7a21-8000-000000000003",
  "kind": "ArtifactRef",
  "media_type": "application/json",
  "provenance_parents": [],
  "schema_version": "1.0.0",
  "size_bytes": 128,
  "storage_class": "private_content_addressed"
}
